<?xml version="1.0" encoding="UTF-8"?>
<xs:schema xmlns:xs="http://www.w3.org/2001/XMLSchema">
	<xs:element name="payment" type="paymentType"/>
	<xs:complexType name="paymentType">
		<xs:sequence>
			<xs:element name="order-no" type="xs:string"/>
			<xs:element name="unique-merchant-no" type="xs:string"/>
			<xs:element name="tx-detail" type="txDetailType"/>
		</xs:sequence>
	</xs:complexType>

	<xs:complexType name="txDetailType">
		<xs:choice>
			<xs:element name="card" type="cardType"/>
			<xs:element name="cash" type="cashType"/>
		</xs:choice>
	</xs:complexType>
	<xs:complexType name="cardType">
		<xs:sequence>
			<xs:element name="card-no" type="xs:string"/>
			<xs:element name="expiry-date" type="xs:string"/>
			<xs:element name="issued-bank" type="xs:string"/>
			<xs:element name="cvv" type="xs:int"/>		
		</xs:sequence>
	</xs:complexType>

	
	<xs:complexType name="cashType">
		<xs:sequence>
			<xs:element name="amount-paid" type="xs:float"/>			<xs:element name="denomination" type="denominationType"/>		
		</xs:sequence>
	</xs:complexType>



	<xs:complexType name="denominationType">
		<xs:sequence>
			<xs:element name="note" type="noteType" minOccurs="1" maxOccurs="unbounded"/>
		</xs:sequence>
	</xs:complexType>
	
	<xs:complexType name="noteType">
		<xs:sequence>
			<xs:element name="value" type="xs:int"/>
			<xs:element name="count" type="xs:int"/>
		</xs:sequence>
	</xs:complexType>
	
</xs:schema>













